text,read_code,read_term
Open traumatic subluxation midcarpal joint,S4333,Open traumatic subluxation mid carpal joint
Open traumatic subluxation carpometacarpal joint,S4334,Open traumatic subluxation CMCJ
Open traumatic subluxation lunate (volar),S4335,Open traumatic subluxation lunate (volar)
Open traumatic subluxation perilunate (dorsal),S4336,Open traumatic subluxation peri-lunate (dorsal)
Closed dislocation of interphalangeal joint of thumb,S44..,Dislocation or subluxation of finger or thumb
Traumatic dislocation of joint of thumb,S44..,Dislocation or subluxation of finger or thumb
Dislocation of metacarpophalangeal joint,S44..,Dislocation or subluxation of finger or thumb
Subluxation of finger,S44..,Dislocation or subluxation of finger or thumb
Subluxation of thumb,S44..,Dislocation or subluxation of finger or thumb
Closed traumatic dislocation digit,S440.,Closed traumatic dislocation digit
"Closed traumatic dislocation, metacarpophalangeal joint",S4401,"Closed traumatic dislocation, metacarpophalangeal joint"
Closed traumatic interphalangeal dislocation,S4402,Closed traumatic interphalangeal dislocation
"Closed traumatic dislocation, distal interphalangeal joint",S4403,"Closed traumatic dislocation, distal interphalangeal joint"
"Closed traumatic dislocation, proximal interphalangeal joint",S4404,"Closed traumatic dislocation, proximal interphalangeal joint"
"Closed traumatic subluxation, interphalangeal joint of thumb",S4405,"Closed traumatic dislocation, interphalangeal joint,thumb"
Closed traumatic dislocation multiple digits,S4406,Closed traumatic dislocation multiple digits
Open traumatic dislocation digit,S441.,Open traumatic dislocation digit
Open traumatic dislocation metacarpophalangeal joint,S4411,Open traumatic dislocation metacarpophalangeal joint
Open traumatic interphalangeal dislocation,S4412,Open traumatic interphalangeal dislocation
"Open traumatic dislocation, distal interphalangeal joint",S4413,"Open traumatic dislocation, distal interphalangeal joint"
"Open traumatic dislocation, proximal interphalangeal joint",S4414,"Open traumatic dislocation, proximal interphalangeal joint"
"Open traumatic dislocation, interphalangeal joint,thumb",S4415,"Open traumatic dislocation, interphalangeal joint,thumb"
Open traumatic dislocation multiple digits,S4416,Open traumatic dislocation multiple digits
Closed traumatic subluxation digit,S442.,Closed traumatic subluxation digit
"Closed traumatic subluxation, metacarpophalangeal joint",S4421,"Closed traumatic subluxation, metacarpophalangeal joint"
"Closed traumatic subluxation, distal interphalangeal joint",S4422,"Closed traumatic subluxation, distal interphalangeal joint"
"Closed traumatic subluxation, proximal interphalangeal joint",S4423,"Closed traumatic subluxation, proximal interphalangeal joint"
Closed traumatic subluxation multiple digits,S4425,Closed traumatic subluxation multiple digits
Open traumatic subluxation digit,S443.,Open traumatic subluxation digit
"Open traumatic subluxation, metacarpophalangeal joint",S4431,"Open traumatic subluxation, metacarpophalangeal joint"
"Open traumatic subluxation, interphalangeal joint thumb",S4432,"Open traumatic subluxation, interphalangeal joint thumb"
"Open traumatic subluxation, distal interphalangeal joint",S4433,"Open traumatic subluxation, distal interphalangeal joint"
"Open traumatic subluxation, proximal interphalangeal joint",S4434,"Open traumatic subluxation, proximal interphalangeal joint"
Open traumatic subluxation multiple digits,S4435,Open traumatic subluxation multiple digits
Dislocation of hip joint,S45..,Dislocation or subluxation of hip
Closed traumatic dislocation of hip,S450.,Closed traumatic dislocation of hip
"Closed traumatic dislocation hip joint, posterior",S4501,"Closed traumatic dislocation hip joint, posterior"
Closed traumatic obturator dislocation of hip,S4502,Closed traumatic obturator dislocation of hip
"Closed traumatic dislocation hip joint, anterior",S4503,"Closed traumatic dislocation hip joint, anterior"
"Open traumatic dislocation hip joint, posterior",S4511,"Open traumatic dislocation hip joint, posterior"
Open traumatic obturator dislocation of hip,S4512,Open traumatic obturator dislocation of hip
"Open traumatic dislocation hip joint, anterior",S4513,"Open traumatic dislocation hip joint, anterior"
Closed traumatic subluxation hip joint,S452.,Closed traumatic subluxation hip joint
"Closed traumatic subluxation hip joint, posterior",S4521,"Closed traumatic subluxation hip joint, posterior"
"Closed traumatic subluxation hip joint, anterior",S4522,"Closed traumatic subluxation hip joint, anterior"
Open traumatic subluxation hip joint,S453.,Open traumatic subluxation hip joint
"Open traumatic subluxation hip joint, posterior",S4531,"Open traumatic subluxation hip joint, posterior"
"Open traumatic subluxation hip joint, anterior",S4532,"Open traumatic subluxation hip joint, anterior"
Subluxation of patellofemoral joint,S46..,Dislocation or subluxation of knee
Dislocation or subluxation of knee,S46..,Dislocation or subluxation of knee
Lateral patellofemoral dislocation,S46..,Dislocation or subluxation of knee
Dislocation of patellofemoral joint,S46..,Dislocation or subluxation of knee
"Acute meniscal tear, medial",S460.,"Acute meniscal tear, medial"
"Acute meniscal tear, medial, anterior horn",S4600,"Acute meniscal tear, medial, anterior horn"
"Acute meniscal tear, medial, posterior horn",S4601,"Acute meniscal tear, medial, posterior horn"
"Acute meniscal tear, medial, bucket handle tear",S4602,"Acute meniscal tear, medial, bucket handle tear"
"Acute meniscal tear, medial, radial",S4603,"Acute meniscal tear, medial, radial"
"Acute meniscal tear, medial, peripheral detachment",S4604,"Acute meniscal tear, medial, peripheral detachment"
"Acute meniscal tear, medial, horizontal cleavage",S4605,"Acute meniscal tear, medial, horizontal cleavage"
"Acute meniscal tear, lateral",S461.,"Acute meniscal tear, lateral"
"Acute meniscal tear, lateral, anterior horn",S4610,"Acute meniscal tear, lateral, anterior horn"
"Acute meniscal tear, lateral, posterior horn",S4611,"Acute meniscal tear, lateral, posterior horn"
"Acute meniscal tear, lateral, bucket handle tear",S4612,"Acute meniscal tear, lateral, bucket handle tear"
"Acute meniscal tear, lateral, radial",S4613,"Acute meniscal tear, lateral, radial"
"Acute meniscal tear, lateral, peripheral detachment",S4614,"Acute meniscal tear, lateral, peripheral detachment"
"Acute meniscal tear, lateral, horizontal cleavage",S4615,"Acute meniscal tear, lateral, horizontal cleavage"
Closed left patella dislocation,S463.,Closed traumatic dislocation of patello-femoral joint
Closed right patella dislocation,S463.,Closed traumatic dislocation of patello-femoral joint
Closed traumatic dislocation of patellofemoral joint,S463.,Closed traumatic dislocation of patello-femoral joint
"Closed traumatic dislocation patellofemoral joint, lateral",S4630,"Closed traumatic dislocation patello-femoral joint, lateral"
"Closed traumatic dislocation patellofemoral joint, medial",S4631,"Closed traumatic dislocation patello-femoral joint, medial"
Open traumatic dislocation of patellofemoral joint,S464.,Open traumatic dislocation of patello-femoral joint
"Open traumatic dislocation patellofemoral joint, lateral",S4640,"Open traumatic dislocation patello-femoral joint, lateral"
"Open traumatic dislocation patellofemoral joint, medial",S4641,"Open traumatic dislocation patello-femoral joint, medial"
Closed traumatic dislocation of knee joint,S465.,Other closed traumatic dislocation of knee
"Closed traumatic dislocation knee joint, anterior",S4651,"Closed traumatic dislocation knee joint, anterior"
"Closed traumatic dislocation knee joint, posterior",S4652,"Closed traumatic dislocation knee joint, posterior"
"Closed traumatic dislocation knee joint, medial",S4653,"Closed traumatic dislocation knee joint, medial"
"Closed traumatic dislocation knee joint, lateral",S4654,"Closed traumatic dislocation knee joint, lateral"
"Closed traumatic dislocation knee joint, rotatory",S4655,"Closed traumatic dislocation knee joint, rotatory"
"Closed traumatic dislocation, head of fibula",S4656,"Closed traumatic dislocation, head of fibula"
Open dislocation of knee,S466.,Other open traumatic dislocation of knee
Open dislocation of patella,S466.,Other open traumatic dislocation of knee
"Open traumatic dislocation knee joint, anterior",S4661,"Open traumatic dislocation knee joint, anterior"
"Open traumatic dislocation knee joint, posterior",S4662,"Open traumatic dislocation knee joint, posterior"
"Open traumatic dislocation knee joint, medial",S4663,"Open traumatic dislocation knee joint, medial"
"Open traumatic dislocation knee joint, lateral",S4664,"Open traumatic dislocation knee joint, lateral"
"Open traumatic dislocation knee joint, rotatory",S4665,"Open traumatic dislocation knee joint, rotatory"
"Open traumatic dislocation, head of fibula",S4666,"Open traumatic dislocation, head of fibula"
Closed traumatic subluxation patellofemoral joint,S467.,Closed traumatic subluxation patello-femoral joint
"Closed traumatic subluxation patellofemoral joint, lateral",S4670,"Closed traumatic subluxation patello-femoral joint, lateral"
"Closed traumatic subluxation patellofemoral joint, medial",S4671,"Closed traumatic subluxation patello-femoral joint, medial"
Open traumatic subluxation patellofemoral joint,S468.,Open traumatic subluxation patello-femoral joint
"Open traumatic subluxation patellofemoral joint, lateral",S4680,"Open traumatic subluxation patello-femoral joint, lateral"
"Open traumatic subluxation patellofemoral joint, medial",S4681,"Open traumatic subluxation patello-femoral joint, medial"
Closed traumatic subluxation knee joint,S469.,Closed traumatic subluxation knee joint
"Closed traumatic subluxation knee joint, anterior",S4691,"Closed traumatic subluxation knee joint, anterior"
"Closed traumatic subluxation knee joint, posterior",S4692,"Closed traumatic subluxation knee joint, posterior"
"Closed traumatic subluxation knee joint, medial",S4693,"Closed traumatic subluxation knee joint, medial"
"Closed traumatic subluxation knee joint, lateral",S4694,"Closed traumatic subluxation knee joint, lateral"
"Closed traumatic subluxation knee joint, rotatory",S4695,"Closed traumatic subluxation knee joint, rotatory"
"Closed traumatic subluxation, head of fibula",S4696,"Closed traumatic subluxation, head of fibula"
Open traumatic subluxation knee joint,S46A.,Open traumatic subluxation knee joint
"Open traumatic subluxation knee joint, anterior",S46A1,"Open traumatic subluxation knee joint, anterior"
"Open traumatic subluxation knee joint, posterior",S46A2,"Open traumatic subluxation knee joint, posterior"
"Open traumatic subluxation knee joint, medial",S46A3,"Open traumatic subluxation knee joint, medial"
"Open traumatic subluxation knee joint, lateral",S46A4,"Open traumatic subluxation knee joint, lateral"
"Open traumatic subluxation knee joint, rotatory",S46A5,"Open traumatic subluxation knee joint, rotatory"
"Open traumatic subluxation, head of fibula",S46A6,"Open traumatic subluxation, head of fibula"
"Tear of articular cartilage of knee, current",S46B.,"Tear of articular cartilage of knee, current"
Injury to multiple structures of knee,S46C.,Injury to multiple structures of knee
Recurrent subluxation of the patella,S46D.,Recurrent subluxation of patella
Dislocation of talus,S47..,Dislocation or subluxation of ankle
Dislocation or subluxation of ankle,S47..,Dislocation or subluxation of ankle
"Dislocation of fibula, distal end",S47..,Dislocation or subluxation of ankle
"Dislocation of tibia, distal end",S47..,Dislocation or subluxation of ankle
Closed traumatic dislocation ankle joint,S470.,Closed traumatic dislocation ankle joint
Closed traumatic subluxation ankle joint,S472.,Closed traumatic subluxation ankle joint
Open traumatic subluxation ankle joint,S473.,Open traumatic subluxation ankle joint
Dislocation or subluxation of foot,S48..,Dislocation or subluxation of foot
Closed traumatic dislocation of joint of foot,S480.,Closed traumatic dislocation of foot
Closed traumatic dislocation of tarsal joint,S4801,"Closed traumatic tarsal dislocation, unspecified"
Closed traumatic dislocation of navicular bone of foot,S4801,"Closed traumatic tarsal dislocation, unspecified"
"Closed traumatic dislocation, midtarsal joint",S4802,"Closed traumatic dislocation, midtarsal joint"
Closed traumatic dislocation of tarsometatarsal joint,S4803,"Closed traumatic dislocation, tarso-metatarsal joint"
"Closed traumatic dislocation, metatarsophalangeal joint, single",S4805,"Cls traumatic dislocation, metatarso-phalangeal jnt, single"
"Closed traumatic dislocation toe, interphalangeal joint, single",S4806,"Closed traumatic dislocation toe, IPJ, single"
"Closed traumatic dislocation, metatarsophalangeal joint, multiple",S4807,"Cls traumatic dislocation, metatarso-phalangeal jnt,multiple"
"Closed traumatic dislocation toe, interphalangeal joint, multiple",S4808,"Closed traumatic dislocation toe, IPJ, multiple"
"Closed traumatic dislocation, pantalar",S4809,"Closed traumatic dislocation, pantalar"
Closed lateral dislocation of subtalar joint,S480A,"Closed traumatic dislocation, subtalar joint"
Closed medial dislocation of subtalar joint,S480A,"Closed traumatic dislocation, subtalar joint"
"Closed traumatic dislocation, subtalar joint",S480A,"Closed traumatic dislocation, subtalar joint"
Open traumatic dislocation of foot,S481.,Open traumatic dislocation of foot
"Open traumatic dislocation, midtarsal joint",S4812,"Open traumatic dislocation, midtarsal joint"
Open traumatic dislocation of tarsometatarsal joint,S4813,"Open traumatic dislocation, tarso-metatarsal joint"
"Open traumatic dislocation, metatarsophalangeal joint, single",S4815,"Open traumatic dislocation, metatarso-phalangeal jnt, single"
"Open traumatic dislocation toe, interphalangeal joint, single",S4816,"Open traumatic dislocation toe, IPJ, single"
"Open traumatic dislocation, metatarsophalangeal joint, multiple",S4817,"Open traumatic dislocation, metatarso-phalangeal jnt, multi"
"Open traumatic dislocation, pantalar",S4819,"Open traumatic dislocation, pantalar"
"Open traumatic dislocation, subtalar joint",S481A,"Open traumatic dislocation, subtalar joint"
"Closed traumatic subluxation, midtarsal joint",S4822,"Closed traumatic subluxation, midtarsal joint"
Closed traumatic subluxation of tarsometatarsal joint,S4823,"Closed traumatic subluxation, tarso-metatarsal joint"
"Closed traumatic subluxation, metatarsophalangeal joint, single",S4824,"Cls traumatic subluxation, metatarso-phalangeal jnt, single"
"Closed traumatic subluxation toe, interphalangeal joint, single",S4825,"Closed traumatic subluxation toe, IPJ, single"
"Closed traumatic subluxation, metatarsophalangeal joint, multiple",S4826,"Cls traumatic subluxation, metatarso-phalangeal joint, multi"
"Closed traumatic subluxation toe, interphalangeal joint, multiple",S4827,"Closed traumatic subluxation toe, IPJ, multiple"
"Closed traumatic subluxation, pantalar",S4828,"Closed traumatic subluxation, pantalar"
"Closed traumatic subluxation, subtalar joint",S4829,"Closed traumatic subluxation, subtalar joint"
"Open traumatic subluxation, foot",S483.,"Open traumatic subluxation, foot"
"Open traumatic subluxation, midtarsal joint",S4832,"Open traumatic subluxation, midtarsal joint"
Open traumatic subluxation of tarsometatarsal joint,S4833,"Open traumatic subluxation, tarso-metatarsal joint"
"Open traumatic subluxation, metatarsophalangeal joint, single",S4834,"Open traumatic subluxation, metatarso-phalangeal jnt, single"
"Open traumatic subluxation toe, interphalangeal joint, single",S4835,"Open traumatic subluxation toe, IPJ, single"
"Open traumatic subluxation, metatarsophalangeal joint, multiple",S4836,"Op traumatic subluxation, metatarso-phalangeal jnt, multiple"
"Open traumatic subluxation toe, interphalangeal joint, multiple",S4837,"Open traumatic subluxation toe, IPJ, multiple"
"Open traumatic subluxation, pantalar",S4838,"Open traumatic subluxation, pantalar"
"Open traumatic subluxation, subtalar joint",S4839,"Open traumatic subluxation, subtalar joint"
Closed dislocation cervical spine,S490.,Closed dislocation cervical spine
Closed dislocation atlanto-occipital joint,S4901,Closed dislocation atlanto-occipital joint
Closed dislocation atlantoaxial joint,S4902,Closed dislocation atlanto-axial joint
Closed dislocation C2/C3,S4903,Closed dislocation C2/C3
Closed dislocation C3/C4,S4904,Closed dislocation C3/C4
Closed dislocation C4/C5,S4905,Closed dislocation C4/C5
Closed dislocation C5/C6,S4906,Closed dislocation C5/C6
Closed dislocation C6/C7,S4907,Closed dislocation C6/C7
Closed dislocation C7/T1,S4908,Closed dislocation C7/T1
Closed spinal dislocation with complete cervical cord lesion,S490A,Closed spinal dislocation with complete cervical cord lesion
Closed spinal dislocation with anterior cervical cord lesion,S490B,Closed spinal dislocation with anterior cervical cord lesion
Closed spinal dislocation with central cervical cord lesion,S490C,Closed spinal dislocation with central cervical cord lesion
Closed spinal dislocation with posterior cervical cord lesion,S490D,Closed spinal dislocation wth posterior cervical cord lesion
Open dislocation of second cervical vertebra,S491.,Open dislocation cervical spine
Open dislocation of third cervical vertebra,S491.,Open dislocation cervical spine
Open dislocation of fourth cervical vertebra,S491.,Open dislocation cervical spine
Open dislocation of cervical spine,S491.,Open dislocation cervical spine
Open dislocation of sixth cervical vertebra,S491.,Open dislocation cervical spine
Open dislocation of first cervical vertebra,S491.,Open dislocation cervical spine
Open dislocation of seventh cervical vertebra,S491.,Open dislocation cervical spine
Open dislocation of fifth cervical vertebra,S491.,Open dislocation cervical spine
Open dislocation atlanto-occipital joint,S4911,Open dislocation atlanto-occipital joint
Open dislocation atlantoaxial joint,S4912,Open dislocation atlanto-axial joint
Open dislocation C2/C3,S4913,Open dislocation C2/C3
Open dislocation C3/C4,S4914,Open dislocation C3/C4
Open dislocation C4/C5,S4915,Open dislocation C4/C5
Open dislocation C5/C6,S4916,Open dislocation C5/C6
Open dislocation C6/C7,S4917,Open dislocation C6/C7
Open dislocation C7/T1,S4918,Open dislocation C7/T1
Open spinal dislocation with complete cervical cord lesion,S491A,Open spinal dislocation with complete cervical cord lesion
Open spinal dislocation with anterior cervical cord lesion,S491B,Open spinal dislocation with anterior cervical cord lesion
Open spinal dislocation with central cervical cord lesion,S491C,Open spinal dislocation with central cervical cord lesion
Open spinal dislocation with posterior cervical cord lesion,S491D,Open spinal dislocation with posterior cervical cord lesion
Open dislocation of multiple cervical vertebrae,S491x,Open dislocation of multiple cervical vertebrae
Closed dislocation of thoracic and/or lumbar spine,S492.,Closed dislocation of thoracic and lumbar spine
Closed dislocation lumbar spine,S4920,Closed dislocation lumbar spine
Closed dislocation thoracic spine,S4921,Closed dislocation thoracic spine
Closed spinal dislocation with complete thoracic cord lesion,S4923,Closed spinal dislocation with complete thoracic cord lesion
Closed spinal dislocation with anterior thoracic cord lesion,S4924,Closed spinal dislocation with anterior thoracic cord lesion
Closed spinal dislocation with central thoracic cord lesion,S4925,Closed spinal dislocation with central thoracic cord lesion
Closed spinal dislocation with posterior thoracic cord lesion,S4926,Closed spinal dislocation wth posterior thoracic cord lesion
Closed spinal dislocation with complete lumbar cord lesion,S4928,Closed spinal dislocation with complete lumbar cord lesion
Closed spinal dislocation with anterior lumbar cord lesion,S4929,Closed spinal dislocation with anterior lumbar cord lesion
Closed spinal dislocation with central lumbar cord lesion,S492A,Closed spinal dislocation with central lumbar cord lesion
Closed spinal dislocation with posterior lumbar cord lesion,S492B,Closed spinal dislocation with posterior lumbar cord lesion
Closed spinal dislocation with cauda equina lesion,S492C,Closed spinal dislocation with cauda equina lesion
Open dislocation of thoracic and/or lumbar spine,S493.,Open dislocation of thoracic and lumbar spine
Open dislocation of lumbar vertebra,S4930,Open dislocation lumbar spine
Open dislocation of lumbosacral joint,S4930,Open dislocation lumbar spine
Open dislocation thoracic spine,S4931,Open dislocation thoracic spine
Open spinal dislocation with complete thoracic cord lesion,S4933,Open spinal dislocation with complete thoracic cord lesion
Open spinal dislocation with anterior thoracic cord lesion,S4934,Open spinal dislocation with anterior thoracic cord lesion
Open spinal dislocation with central thoracic cord lesion,S4935,Open spinal dislocation with central thoracic cord lesion
Open spinal dislocation with posterior thoracic cord lesion,S4936,Open spinal dislocation with posterior thoracic cord lesion
Open spinal dislocation with complete lumbar cord lesion,S4938,Open spinal dislocation with complete lumbar cord lesion
Open spinal dislocation with anterior lumbar cord lesion,S4939,Open spinal dislocation with anterior lumbar cord lesion
Open spinal dislocation with central lumbar cord lesion,S493A,Open spinal dislocation with central lumbar cord lesion
Open spinal dislocation with posterior lumbar cord lesion,S493B,Open spinal dislocation with posterior lumbar cord lesion
Open spinal dislocation with cauda equina lesion,S493C,Open spinal dislocation with cauda equina lesion
Closed traumatic dislocation of vertebra,S494.,Closed dislocation of other vertebra
Multiple closed dislocations of back,S494.,Closed dislocation of other vertebra
Closed traumatic dislocation of coccyx,S4941,Closed dislocation of coccyx
Closed dislocation of sacrum,S4942,Closed dislocation of sacrum
Open dislocation of vertebra,S495.,Open dislocation of other vertebra
Open dislocation of coccyx,S4951,Open dislocation of coccyx
Open dislocation of sacrum,S4952,Open dislocation of sacrum
Closed traumatic dislocation of sternum,S4960,Closed traumatic dislocation of sternum
Closed traumatic dislocation of pelvis,S4961,Closed traumatic dislocation of pelvis
Closed traumatic dislocation sternoclavicular joint,S4962,Closed traumatic dislocation sterno-clavicular joint
"Closed traumatic dislocation, sternoclavicular joint, anterior",S4963,"Closed traumatic dislocation, sterno-clavicular joint, ant"
"Closed traumatic dislocation, sternoclavicular joint, posterior",S4964,"Closed traumatic dislocation, sterno-clavicular joint, post"
Closed traumatic dislocation laryngeal cartilage,S4965,Closed traumatic dislocation laryngeal cartilage
Closed traumatic dislocation costovertebral joint,S4966,Closed traumatic dislocation costo-vertebral joint
Closed traumatic dislocation of costochondral joint,S4967,Closed traumatic dislocation costo-chondral joint
Open traumatic dislocation of sternum,S4970,Open traumatic dislocation of sternum
Open traumatic dislocation of pelvis,S4971,Open traumatic dislocation of pelvis
Open traumatic dislocation sternoclavicular joint,S4972,Open traumatic dislocation sterno-clavicular joint
"Open traumatic dislocation, sternoclavicular joint, anterior",S4973,"Open traumatic dislocation, sterno-clavicular joint, ant"
"Open traumatic dislocation, sternoclavicular joint, posterior",S4974,"Open traumatic dislocation, sterno-clavicular joint, post"
Open traumatic dislocation laryngeal cartilage,S4975,Open traumatic dislocation laryngeal cartilage
Open traumatic dislocation costovertebral joint,S4976,Open traumatic dislocation costo-vertebral joint
Open traumatic dislocation of costochondral joint,S4977,Open traumatic dislocation costo-chondral joint
Closed subluxation cervical spine,S498.,Closed subluxation cervical spine
Closed subluxation atlanto-occipital joint,S4981,Closed subluxation atlanto-occipital joint
Closed subluxation atlantoaxial joint,S4982,Closed subluxation atlanto-axial joint
Closed subluxation C2/C3,S4983,Closed subluxation C2/C3
Closed subluxation C3/C4,S4984,Closed subluxation C3/C4
Closed subluxation C4/C5,S4985,Closed subluxation C4/C5
Closed subluxation C5/C6,S4986,Closed subluxation C5/C6
Closed subluxation C6/C7,S4987,Closed subluxation C6/C7
Closed subluxation C7/T1,S4988,Closed subluxation C7/T1
Closed spinal subluxation with complete cervical cord lesion,S498A,Closed spinal subluxation with complete cervical cord lesion
Closed spinal subluxation with anterior cervical cord lesion,S498B,Closed spinal subluxation with anterior cervical cord lesion
Closed spinal subluxation with central cervical cord lesion,S498C,Closed spinal subluxation with central cervical cord lesion
Closed spinal subluxation with posterior cervical cord lesion,S498D,Closed spinal subluxation + posterior cervical cord lesion
Closed subluxation of multiple cervical vertebrae,S498x,Closed subluxation of multiple cervical vertebrae
Open subluxation cervical spine,S499.,Open subluxation cervical spine
Open subluxation atlanto-occipital joint,S4991,Open subluxation atlanto-occipital joint
Open subluxation atlantoaxial joint,S4992,Open subluxation atlanto-axial joint
Open subluxation C2/C3,S4993,Open subluxation C2/C3
Open subluxation C3/C4,S4994,Open subluxation C3/C4
Open subluxation C4/C5,S4995,Open subluxation C4/C5
Open subluxation C5/C6,S4996,Open subluxation C5/C6
Open subluxation C6/C7,S4997,Open subluxation C6/C7
Open subluxation C7/T1,S4998,Open subluxation C7/T1
Open spinal subluxation with complete cervical cord lesion,S499A,Open spinal subluxation with complete cervical cord lesion
Open spinal subluxation with anterior cervical cord lesion,S499B,Open spinal subluxation with anterior cervical cord lesion
