text,read_code,read_term
"Open crush injury hand, palm",SF229,"Open crush injury hand, palm"
Crushing injury of finger,SF23.,"Crush injury, finger(s)"
"Closed crush injury, finger",SF230,"Closed crush injury, finger"
"Closed crush injury, thumb",SF231,"Closed crush injury, thumb"
"Closed crush injury, finger, multiple",SF232,"Closed crush injury, finger, multiple"
"Open crush injury, finger",SF233,"Open crush injury, finger"
"Open crush injury, thumb",SF234,"Open crush injury, thumb"
"Open crush injury, finger, multiple",SF235,"Open crush injury, finger, multiple"
Crushing injury of multiple sites of upper limb,SF2y.,"Crush injury, arm, multiple sites"
Crushing injury of lower limb,SF3..,"Crush injury, lower limb"
Crush injury of hip and thigh,SF30.,"Crush injury, hip and thigh"
Crushing injury of thigh,SF300,"Crush injury, thigh"
Crushing injury of hip,SF301,"Crush injury, hip"
"Closed crush injury, thigh",SF302,"Closed crush injury, thigh"
"Open crush injury, thigh",SF303,"Open crush injury, thigh"
"Closed crush injury, hip",SF304,"Closed crush injury, hip"
"Open crush injury, hip",SF305,"Open crush injury, hip"
"Crush injury, knee and lower leg",SF31.,"Crush injury, knee and lower leg"
Crushing injury of lower leg,SF310,"Crush injury, lower leg"
Crushing injury of knee,SF311,"Crush injury, knee"
"Closed crush injury, lower leg",SF312,"Closed crush injury, lower leg"
"Closed crush injury, knee",SF313,"Closed crush injury, knee"
"Open crush injury, lower leg",SF314,"Open crush injury, lower leg"
"Open crush injury, knee",SF315,"Open crush injury, knee"
"Crush injury, ankle and foot, excluding toe(s)",SF32.,"Crush injury, ankle and foot, excluding toe(s)"
Crush injury of dorsum of foot,SF320,"Crush injury, foot"
Crushing injury of foot,SF320,"Crush injury, foot"
Crush injury of sole of foot,SF320,"Crush injury, foot"
Crushing injury of heel,SF320,"Crush injury, foot"
Crushing injury of ankle,SF321,"Crush injury, ankle"
"Closed crush injury, foot",SF322,"Closed crush injury, foot"
"Closed crush injury, ankle",SF323,"Closed crush injury, ankle"
"Open crush injury, foot",SF324,"Open crush injury, foot"
"Open crush injury, ankle",SF325,"Open crush injury, ankle"
Crush injury of great toe,SF33.,"Crush injury, toe(s)"
Crushing injury of multiple sites of lower limb,SF3y.,"Crush injury, lower limb, multiple sites"
Insect in external auditory meatus,SG10.,Foreign body in auditory canal
Glass in nose,SG2..,Foreign body in nose
Metal foreign body in nose,SG2..,Foreign body in nose
Foreign body in nose,SG2..,Foreign body in nose
Foreign body in nostril,SG20.,Foreign body in nostril
Foreign body in nasal sinus,SG21.,Foreign body in nasal sinus
Foreign body in maxillary sinus,SG21.,Foreign body in nasal sinus
Foreign body in pharynx and larynx,SG3..,Foreign body in pharynx and larynx
Fishbone in throat,SG30.,Foreign body in pharynx
Foreign body in pharynx,SG30.,Foreign body in pharynx
Fishing hook in pharynx,SG30.,Foreign body in pharynx
Bone in pharynx,SG30.,Foreign body in pharynx
Metal foreign body in pharynx,SG30.,Foreign body in pharynx
Glass in pharynx,SG30.,Foreign body in pharynx
Foreign body in nasopharynx,SG300,Foreign body in nasopharynx
Foreign body in larynx,SG31.,Foreign body in larynx
Foreign body in trachea,SG40.,Foreign body in trachea
Foreign body in left main bronchus,SG41.,Foreign body in main bronchus
Foreign body in right main bronchus,SG41.,Foreign body in main bronchus
Foreign body in main bronchus,SG41.,Foreign body in main bronchus
Foreign body in bronchioles,SG42.,Foreign body in bronchioles
Foreign body in lung,SG43.,Foreign body in lung
Foreign body in mouth and/or oesophagus and/or stomach,SG5..,"Foreign body in mouth, oesophagus and stomach"
Glass in mouth,SG50.,Foreign body in mouth
Fishing hook in mouth,SG50.,Foreign body in mouth
Metal foreign body in mouth,SG50.,Foreign body in mouth
Foreign body in mouth,SG50.,Foreign body in mouth
Foreign body of oral cavity and salivary gland,SG50.,Foreign body in mouth
Chicken bone in esophagus,SG51.,Foreign body in oesophagus
Foreign body in mid part of oesophagus,SG51.,Foreign body in oesophagus
Foreign body in oesophagus,SG51.,Foreign body in oesophagus
Foreign body at cardia,SG52.,Foreign body in stomach
Foreign body in stomach,SG52.,Foreign body in stomach
Foreign body in intestine and colon,SG6..,Foreign body in intestine or colon
Foreign body in colon,SG6..,Foreign body in intestine or colon
Foreign body in duodenum,SG60.,Foreign body in duodenum
Foreign body in jejunum,SG61.,Foreign body in jejunum
Foreign body in ileum,SG62.,Foreign body in ileum
Foreign body at terminal ileum,SG62.,Foreign body in ileum
Foreign body in appendix,SG63.,Foreign body in appendix
Foreign body in caecum,SG64.,Foreign body in caecum
Foreign body in transverse colon,SG66.,Foreign body in transverse colon
Foreign body in descending colon,SG67.,Foreign body in descending colon
Foreign body in sigmoid colon,SG68.,Foreign body in pelvic colon
Foreign body in anus and rectum,SG7..,Foreign body in anus and rectum
Foreign body in rectum,SG70.,Foreign body in rectum
Foreign body in anus,SG71.,Foreign body in anus
Foreign body of large intestine,SG8..,Foreign body in alimentary tract NOS
Foreign body in intestine,SG8..,Foreign body in alimentary tract NOS
Linear foreign body of gastrointestinal tract,SG8..,Foreign body in alimentary tract NOS
Swallowed foreign body,SG8..,Foreign body in alimentary tract NOS
Burn confined to eye and adnexa,SH0..,Burn confined to eye and adnexa
Burn of conjunctiva,SH0..,Burn confined to eye and adnexa
Chemical burn of eyelid region,SH00.,Chemical burn of eyelids and periocular area
Alkaline chemical burn of cornea and conjunctival sac,SH02.,Alkaline chemical burn of cornea and conjunctival sac
Acid chemical burn of cornea and conjunctival sac,SH03.,Acid chemical burn of cornea and conjunctival sac
Eyelid burn,SH0x.,Burn of eyelid NOS
Thermal burn of eyelid,SH0x.,Burn of eyelid NOS
Chemical burn of eyelid,SH0x.,Burn of eyelid NOS
Acid chemical burn of cornea,SH0y.,Burn of cornea NOS
Corneal burn,SH0y.,Burn of cornea NOS
Chemical keratitis,SH0y.,Burn of cornea NOS
Thermal and radiation injury to the cornea,SH0y.,Burn of cornea NOS
Chemical injury to cornea,SH0y.,Burn of cornea NOS
Alkaline chemical burn of cornea,SH0y.,Burn of cornea NOS
Burn to cornea - blister,SH0y.,Burn of cornea NOS
Burn of head AND/OR neck,SH1..,"Burn of the face, head or neck"
Head burn,SH1..,"Burn of the face, head or neck"
Burn of face,SH1..,"Burn of the face, head or neck"
Burn of ear,SH101,Unspecified thickness burn of the ear
Flash burn of eye,SH102,Unspecified thickness burn of the eye
Burn of labial mucosa,SH103,Unspecified thickness burn of the lip(s)
Burn of lip,SH103,Unspecified thickness burn of the lip(s)
Burn erythema of labial mucosa,SH103,Unspecified thickness burn of the lip(s)
Epidermal burn of lip,SH103,Unspecified thickness burn of the lip(s)
Burn of chin,SH104,Unspecified thickness burn of the chin
Burn of scalp,SH106,Unspecified thickness burn of the scalp
Burn of forehead,SH107,Unspecified thickness burn of the forehead
Burn of cheek,SH108,Unspecified thickness burn of the cheek
Complex burn of neck,SH109,Unspecified thickness burn of the neck
Burn of multiple sites of neck,SH109,Unspecified thickness burn of the neck
Burn of neck,SH109,Unspecified thickness burn of the neck
Multiple burns of head and neck,SH10x,"Unspecified thickness burn multiple sites face, head or neck"
Epidermal burn of ear,SH111,Superficial burn of the ear
Superficial corrosion of ear,SH111,Superficial burn of the ear
Superficial corrosion of lip,SH113,Superficial burn of the lip(s)
Epidermal burn of chin,SH114,Superficial burn of the chin
Superficial corrosion of chin,SH114,Superficial burn of the chin
Epidermal burn of nose,SH115,Superficial burn of the nose
Superficial corrosion of nose,SH115,Superficial burn of the nose
Superficial corrosion of scalp,SH116,Superficial burn of the scalp
Epidermal burn of scalp,SH116,Superficial burn of the scalp
Superficial corrosion of forehead,SH117,Superficial burn of the forehead
Epidermal burn of forehead,SH117,Superficial burn of the forehead
Epidermal burn of cheek,SH118,Superficial burn of the cheek
Superficial corrosion of cheek,SH118,Superficial burn of the cheek
Epidermal burn of multiple sites of neck,SH119,Superficial burn of the neck
Superficial corrosion of neck,SH119,Superficial burn of the neck
Epidermal burn of neck,SH119,Superficial burn of the neck
Superficial partial thickness burn of ear,SH121,Superficial partial thickness burn of the ear
Superficial partial thickness burn of chin,SH124,Superficial partial thickness burn of the chin
Superficial partial thickness burn of nose,SH125,Superficial partial thickness burn of the nose
Superficial partial thickness burn of scalp,SH126,Superficial partial thickness burn of the scalp
Superficial partial thickness burn of forehead,SH127,Superficial partial thickness burn of the forehead
Superficial partial thickness burn of cheek,SH128,Superficial partial thickness burn of the cheek
Superficial partial thickness burn of neck,SH129,Superficial partial thickness burn of the neck
Deep partial thickness burn of ear,SH12B,Deep partial thickness burn of the ear
Deep partial thickness burn of chin,SH12E,Deep partial thickness burn of the chin
Deep partial thickness burn of nose,SH12F,Deep partial thickness burn of the nose
Deep partial thickness burn of scalp,SH12G,Deep partial thickness burn of the scalp
Deep partial thickness burn of forehead,SH12H,Deep partial thickness burn of the forehead
Deep partial thickness burn of cheek,SH12J,Deep partial thickness burn of the cheek
Deep partial thickness burn of neck,SH12K,Deep partial thickness burn of the neck
Full thickness burn of ear,SH131,Full thickness burn of the ear
Deep third degree burn of lip,SH133,Full thickness burn of the lip(s)
Third degree burn of labial mucosa,SH133,Full thickness burn of the lip(s)
Deep third degree burn of chin,SH134,Full thickness burn of the chin
Full thickness burn of chin,SH134,Full thickness burn of the chin
Deep third degree burn of nose,SH135,Full thickness burn of the nose
Third degree burn of nose,SH135,Full thickness burn of the nose
Full thickness burn of scalp,SH136,Full thickness burn of the scalp
Deep third degree burn of scalp,SH136,Full thickness burn of the scalp
Full thickness burn of forehead,SH137,Full thickness burn of the forehead
Full thickness burn of cheek,SH138,Full thickness burn of the cheek
Full thickness burn of neck,SH139,Full thickness burn of the neck
Deep third degree burn of neck,SH139,Full thickness burn of the neck
Full thickness burn of multiple sites of neck,SH139,Full thickness burn of the neck
Corrosion of third degree of head and neck,SH13A,Corrosion of third degree of head and neck
Full thickness burn of head and/or neck,SH13z,"Full thickness burn of the face, head or neck NOS"
Corrosion of head and neck,SH16.,Corrosion of head and neck
Corrosion of first degree of head and neck,SH160,Corrosion of first degree of head and neck
Corrosion of second degree of head and neck,SH161,Corrosion of second degree of head and neck
Burn of trunk,SH2..,Burn of the trunk
Complex burn of trunk,SH2..,Burn of the trunk
Burn of pelvic region,SH2..,Burn of the trunk
Burn of breast,SH201,Unspecified thickness burn of the breast
Burn of chest wall,SH202,Unspecified thickness burn of the chest wall
Burn of abdominal wall,SH203,Unspecified thickness burn of the abdominal wall
Burn of back,SH204,Unspecified thickness burn of the back (excluding buttock)
Burn of buttock,SH205,Unspecified thickness burn of the buttock
Burn of genitalia,SH206,Unspecified thickness burn of the genitalia
Burn of multiple sites of trunk,SH20x,Unspecified thickness burn of multiple sites of the trunk
Epidermal burn of trunk,SH21.,Superficial burn of the trunk
Superficial corrosion of breast,SH211,Superficial burn of the breast
Epidermal burn of breast,SH211,Superficial burn of the breast
Burn erythema of chest wall,SH212,Superficial burn of the chest wall
Superficial corrosion of chest wall,SH212,Superficial burn of the chest wall
Burn erythema of abdominal wall,SH213,Superficial burn of the abdominal wall
Superficial burn of back (excluding buttock),SH214,Superficial burn of the back (excluding buttock)
Superficial corrosion of buttock,SH215,Superficial burn of the buttock
Superficial burn of buttock,SH215,Superficial burn of the buttock
Epidermal burn of genitalia,SH216,Superficial burn of the genitalia
Superficial corrosion of genitalia,SH216,Superficial burn of the genitalia
Corrosion of first degree of trunk,SH217,Corrosion of first degree of trunk
Epidermal burn of multiple sites of trunk,SH21x,Superficial burn of multiple sites of the trunk
Superficial partial thickness burn of breast,SH221,Superficial partial thickness burn of the breast
Superficial partial thickness burn of chest wall,SH222,Superficial partial thickness burn of the chest wall
Superficial partial thickness burn of abdominal wall,SH223,Superficial partial thickness burn of the abdominal wall
Superficial partial thickness burn of the back (excluding buttock),SH224,Superficial partial thickness burn of back (excl buttock)
Superficial partial thickness burn of buttock,SH225,Superficial partial thickness burn of the buttock
Superficial partial thickness burn of genitalia,SH226,Superficial partial thickness burn of the genitalia
Deep partial thickness burn of breast,SH228,Deep partial thickness burn of the breast
Deep partial thickness burn of chest wall,SH229,Deep partial thickness burn of the chest wall
Deep partial thickness burn of abdominal wall,SH22A,Deep partial thickness burn of the abdominal wall
Deep partial thickness burn of back (excluding buttock),SH22B,Deep partial thickness burn of the back (excluding buttock)
Deep partial thickness burn of buttock,SH22C,Deep partial thickness burn of the buttock
Deep partial thickness burn of genitalia,SH22D,Deep partial thickness burn of the genitalia
Corrosion of second degree of trunk,SH22E,Corrosion of second degree of trunk
Partial thickness burn of multiple sites of trunk,SH22x,Partial thickness burn of multiple sites of the trunk
Full thickness burn of trunk,SH23.,Full thickness burn of the trunk
Deep third degree burn of trunk,SH23.,Full thickness burn of the trunk
Third degree burn of breast,SH231,Full thickness burn of the breast
Deep third degree burn of breast,SH231,Full thickness burn of the breast
Deep third degree burn of chest wall,SH232,Full thickness burn of the chest wall
Full thickness burn of chest wall,SH232,Full thickness burn of the chest wall
Full thickness burn of buttock,SH235,Full thickness burn of the buttock
Full thickness burn of genitalia,SH236,Full thickness burn of the genitalia
Corrosion of third degree of trunk,SH237,Corrosion of third degree of trunk
Full thickness burn of multiple sites of trunk,SH23x,Full thickness burn of multiple sites of the trunk
Burn of upper limb,SH30.,Unspecified thickness burn of the arm
Complex burn of upper limb,SH30.,Unspecified thickness burn of the arm
Burn of forearm,SH301,Unspecified thickness burn of the forearm
Burn of elbow,SH302,Unspecified thickness burn of the elbow
Burn of upper arm,SH303,Unspecified thickness burn of the upper arm
Burn of axilla,SH304,Unspecified thickness burn of the axilla
Burn of shoulder,SH305,Unspecified thickness burn of the shoulder
Complex burn of shoulder,SH305,Unspecified thickness burn of the shoulder
Burn of scapular region,SH306,Unspecified thickness burn of the scapular region
Epidermal burn of upper limb,SH31.,Superficial burn of the arm
Epidermal burn of forearm,SH311,Superficial burn of the forearm
Epidermal burn of elbow,SH312,Superficial burn of the elbow
Epidermal burn of upper arm,SH313,Superficial burn of the upper arm
Epidermal burn of axilla,SH314,Superficial burn of the axilla
Epidermal burn of shoulder,SH315,Superficial burn of the shoulder
Epidermal burn of scapular region,SH316,Superficial burn of the scapular region
Epidermal burn of multiple sites of upper limb,SH31x,Superficial burn of multiple sites of the arm
Superficial partial thickness burn of forearm,SH321,Superficial partial thickness burn of the forearm
Superficial partial thickness burn of elbow,SH322,Superficial partial thickness burn of the elbow
Superficial partial thickness burn of upper arm,SH323,Superficial partial thickness burn of the upper arm
Superficial partial thickness burn of axilla,SH324,Superficial partial thickness burn of the axilla
Superficial partial thickness burn of shoulder,SH325,Superficial partial thickness burn of the shoulder
Superficial partial thickness burn of scapular region,SH326,Superficial partial thickness burn of scapular region
Deep partial thickness burn of forearm,SH328,Deep partial thickness burn of the forearm
Deep partial thickness burn of elbow,SH329,Deep partial thickness burn of the elbow
Deep partial thickness burn of upper arm,SH32A,Deep partial thickness burn of the upper arm
Deep partial thickness burn of axilla,SH32B,Deep partial thickness burn of the axilla
Deep partial thickness burn of shoulder,SH32C,Deep partial thickness burn of the shoulder
Deep partial thickness burn of scapular region,SH32D,Deep partial thickness burn of the scapular region
Partial thickness burn of multiple sites of upper limb,SH32x,Partial thickness burn of multiple sites of the arm
Full thickness burn of forearm,SH331,Full thickness burn of the forearm
Deep third degree burn of forearm,SH331,Full thickness burn of the forearm
Full thickness burn of elbow,SH332,Full thickness burn of the elbow
Deep third degree burn of elbow,SH332,Full thickness burn of the elbow
Deep third degree burn of upper arm,SH333,Full thickness burn of the upper arm
Full thickness burn of upper arm,SH333,Full thickness burn of the upper arm
Full thickness burn of axilla,SH334,Full thickness burn of the axilla
Deep third degree burn of axilla,SH334,Full thickness burn of the axilla
Full thickness burn of shoulder,SH335,Full thickness burn of the shoulder
Deep third degree burn of shoulder,SH335,Full thickness burn of the shoulder
Full thickness burn of scapular region,SH336,Full thickness burn of the scapular region
Deep third degree burn of scapular region,SH336,Full thickness burn of the scapular region
Full thickness burn of multiple sites of upper limb,SH33x,Full thickness burn of multiple sites of the arm
Deep third degree burn of multiple sites of upper limb,SH33x,Full thickness burn of multiple sites of the arm
"Corrosion of first degree of shoulder and upper limb, except wrist and hand",SH360,"Corrosion/1st degree shoulder+upper limb,except wrist+hand"
"Corrosion of second degree of shoulder and upper limb, except wrist and hand",SH361,Corrosion/2nd degree/shoulder and upper limb exc wrist+hand
"Corrosion of third degree of shoulder and upper limb, except wrist and hand",SH362,"Corros/third degree/shoulder and upper limb, exc wrist+hand"
Burn of hand,SH400,"Unspecified thickness burn of the hand, unspecified"
Chemical burn of hand,SH400,"Unspecified thickness burn of the hand, unspecified"
Complex burn of hand,SH400,"Unspecified thickness burn of the hand, unspecified"
Burn of thumb,SH402,Unspecified thickness burn of the thumb
Burn of digit of hand,SH403,Unspecified thickness burn of more than one finger
Burn of palm,SH405,Unspecified thickness burn of the palm of hand
Burn of back of hand,SH406,Unspecified thickness burn of the back of hand
Burn of wrist,SH407,Unspecified thickness burn of the wrist
Complex burn of wrist,SH407,Unspecified thickness burn of the wrist
Epidermal burn of wrist and hand,SH41.,Superficial burn of the wrist and hand
Epidermal burn of hand,SH410,"Superficial burn of the hand, unspecified"
Superficial burn of finger,SH411,Superficial burn of a single finger
Superficial burn of a single finger,SH411,Superficial burn of a single finger
Epidermal burn of thumb,SH412,Superficial burn of the thumb
Superficial burn of more than one finger,SH413,Superficial burn of more than one finger
Superficial burn of the thumb and finger(s),SH414,Superficial burn of the thumb and finger(s)
Epidermal burn of palm,SH415,Superficial burn of the palm of hand
Epidermal burn of back of hand,SH416,Superficial burn of the back of hand
Epidermal burn of wrist,SH417,Superficial burn of the wrist
Partial thickness burn of wrist and hand with blister,SH42.,Partial thickness burn of the wrist and hand
Partial thickness burn of wrist and hand,SH42.,Partial thickness burn of the wrist and hand
Superficial partial thickness burn of thumb,SH422,Superficial partial thickness burn of the thumb
Superficial partial thickness of digit of hand,SH424,Superficial partial thickness burn of thumb and finger(s)
Superficial partial thickness burn of palm of hand,SH425,Superficial partial thickness burn of palm of hand
Superficial partial thickness burn of back of hand,SH426,Superficial partial thickness burn of back of hand
Superficial partial thickness burn of wrist,SH427,Superficial partial thickness burn of the wrist
Deep partial thickness burn of hand,SH428,"Deep partial thickness burn of the hand, unspecified"
Partial thickness burn of hand,SH428,"Deep partial thickness burn of the hand, unspecified"
Deep partial thickness burn of thumb,SH42A,Deep partial thickness burn of the thumb
Deep partial thickness burn of digit of hand,SH42C,Deep partial thickness burn of the thumb and finger(s)
Deep partial thickness burn of palm of hand,SH42D,Deep partial thickness burn of the palm of hand
Deep partial thickness burn of back of hand,SH42E,Deep partial thickness burn of back of hand
Deep partial thickness burn of wrist,SH42F,Deep partial thickness burn of wrist
Full thickness burn of wrist and hand,SH43.,Full thickness burn of the wrist and hand
Deep third degree burn of hand,SH430,"Full thickness burn of the hand, unspecified"
Full thickness burn of hand,SH430,"Full thickness burn of the hand, unspecified"
Deep third degree burn of thumb,SH432,Full thickness burn of the thumb
Full thickness burn of thumb,SH432,Full thickness burn of the thumb
Full thickness burn of the thumb and finger(s),SH434,Full thickness burn of the thumb and finger(s)
Deep third degree burn of palm,SH435,Full thickness burn of the palm of hand
Full thickness burn of palm,SH435,Full thickness burn of the palm of hand
Full thickness burn of back of hand,SH436,Full thickness burn of the back of hand
Deep third degree burn of back of hand,SH436,Full thickness burn of the back of hand
Deep third degree burn of wrist,SH437,Full thickness burn of the wrist
Full thickness burn of wrist,SH437,Full thickness burn of the wrist
Corrosion of wrist and hand,SH46.,Corrosion of wrist and hand
Corrosion of first degree of wrist and hand,SH460,Corrosion of first degree of wrist and hand
Corrosion of second degree of wrist and hand,SH461,Corrosion of second degree of wrist and hand
Corrosion of third degree of wrist and hand,SH462,Corrosion of third degree of wrist and hand
Burn of lower limb,SH5..,Burn of lower limbs
Complex burn of lower limb,SH5..,Burn of lower limbs
Burn of ankle and foot,SH5..,Burn of lower limbs
Burn of toe,SH501,Unspecified thickness burn of the toe(s)
Burn of foot,SH502,Unspecified thickness burn of the foot
Burn of ankle,SH503,Unspecified thickness burn of the ankle
Burn of lower leg,SH504,Unspecified thickness burn of the lower leg
Burn of knee,SH505,Unspecified thickness burn of the knee
Burn of thigh,SH506,Unspecified thickness burn of the thigh
Burn of multiple sites of lower limb,SH50x,Unspecified thickness burn of multiple sites of the leg
Epidermal burn of lower limb,SH51.,Superficial burn of the leg
Epidermal burn of toe,SH511,Superficial burn of the toe(s)
Superficial burn of great toe,SH511,Superficial burn of the toe(s)
Epidermal burn of foot,SH512,Superficial burn of the foot
Epidermal burn of ankle,SH513,Superficial burn of the ankle
Epidermal burn of lower leg,SH514,Superficial burn of the lower leg
Epidermal burn of knee,SH515,Superficial burn of the knee
Epidermal burn of thigh,SH516,Superficial burn of the thigh
Epidermal burn of multiple sites of lower limb,SH51x,Superficial burn of multiple sites of the leg
Superficial partial thickness burn of lower limb,SH52.,Partial thickness burn of the leg
Superficial partial thickness burn of toe(s),SH521,Superficial partial thickness burn of the toe(s)
Superficial partial thickness burn of foot,SH522,Superficial partial thickness burn of the foot
Superficial partial thickness burn of ankle,SH523,Superficial partial thickness burn of the ankle
Superficial partial thickness burn of lower leg,SH524,Superficial partial thickness burn of the lower leg
Superficial partial thickness burn of knee,SH525,Superficial partial thickness burn of the knee
Superficial partial thickness burn of thigh,SH526,Superficial partial thickness burn of the thigh
Deep partial thickness burn of toe(s),SH528,Deep partial thickness burn of the toe(s)
Deep partial thickness burn of foot,SH529,Deep partial thickness burn of the foot
Deep partial thickness burn of ankle,SH52A,Deep partial thickness burn of the ankle
Deep partial thickness burn of lower leg,SH52B,Deep partial thickness burn of the lower leg
Deep partial thickness burn of knee,SH52C,Deep partial thickness burn of the knee
Deep partial thickness burn of thigh,SH52D,Deep partial thickness burn of the thigh
Deep third degree burn of lower limb,SH53.,Full thickness burn of the leg
Full thickness burn of lower limb,SH53.,Full thickness burn of the leg
Deep third degree burn of toe,SH531,Full thickness burn of the toe(s)
Full thickness burn of toe,SH531,Full thickness burn of the toe(s)
Deep third degree burn of foot,SH532,Full thickness burn of the foot
Full thickness burn of foot,SH532,Full thickness burn of the foot
Full thickness burn of ankle,SH533,Full thickness burn of the ankle
